{
  "id": "550e8400-e29b-41d4-a716-446655440000",
  "url": "string",
  "description": "string",
  "name": "string",
  "product": {
    "id": "550e8400-e29b-41d4-a716-446655440000"
  },
  "is_virtual": false,
  "last_four": "string",
  "state": "string",
  "suspension_reason": "string",
  "assigned_to": {
    "id": "550e8400-e29b-41d4-a716-446655440000",
    "url": "string",
    "email": "string",
    "code": "string",
    "first_name": "string",
    "last_name": "string"
  },
  "category": {
    "id": "550e8400-e29b-41d4-a716-446655440000",
    "name": "string",
    "code": "string",
    "parent": {},
    "is_archived": false,
    "created_at": "2024-01-15T10:30:00Z",
    "url": "string"
  },
  "department": {
    "id": "550e8400-e29b-41d4-a716-446655440000",
    "name": "string",
    "code": "string",
    "parent": {},
    "is_archived": false,
    "created_at": "2024-01-15T10:30:00Z",
    "url": "string"
  },
  "location": {
    "id": "550e8400-e29b-41d4-a716-446655440000",
    "name": "string",
    "code": "string",
    "parent": {},
    "is_archived": false,
    "created_at": "2024-01-15T10:30:00Z",
    "url": "string"
  },
  "label": {
    "id": "550e8400-e29b-41d4-a716-446655440000",
    "name": "string",
    "code": "string",
    "parent": {},
    "is_archived": false,
    "created_at": "2024-01-15T10:30:00Z",
    "url": "string"
  },
  "allowance": {
    "id": "550e8400-e29b-41d4-a716-446655440000",
    "url": "string",
    "interval": "string",
    "amount": 0.0,
    "transaction_limit": 0.0,
    "daily_limit": 0.0,
    "single_use": false,
    "start_time": "2024-01-15T10:30:00Z",
    "end_time": "2024-01-15T10:30:00Z",
    "scope": [
      0
    ],
    "balance": 0.0
  },
  "expiration": "string",
  "billing_name": "string",
  "billing_address": "string",
  "shipping_address": "string",
  "shipping": {
    "address": {
      "attn": "string",
      "address_1": "string",
      "address_2": "string",
      "city": "string",
      "state": "string",
      "postal_code": "string",
      "country": "string"
    },
    "carrier": "fedex",
    "eta": "2024-01-15T10:30:00Z",
    "name": "string",
    "order_size": "individual",
    "phone_number": "string",
    "require_signature": false,
    "service": "standard",
    "status": "pending",
    "tracking_number": "string",
    "tracking_url": "string"
  },
  "created_at": "2024-01-15T10:30:00Z",
  "network": "string"
}